{
  "$schema": "http://json-schema.org/draft-07/schema#",
  "$id": "https://modonome.com/schemas/config.schema.json",
  "title": "Modonome config",
  "description": "Spec of record: prompts/modonome.core.md Configuration. Defaults are safe.",
  "type": "object",
  "additionalProperties": false,
  "required": ["schema_version", "autonomy_enabled", "dry_run", "auto_merge", "state_dir"],
  "properties": {
    "schema_version": { "type": "integer", "minimum": 1 },
    "autonomy_enabled": { "type": "boolean" },
    "dry_run": { "type": "boolean" },
    "auto_merge": { "type": "boolean" },
    "max_attempts_per_item": { "type": "integer", "minimum": 1, "maximum": 10 },
    "max_open_prs": { "type": "integer", "minimum": 0, "maximum": 50 },
    "max_diff_lines": { "type": "integer", "minimum": 1 },
    "lease_minutes": { "type": "integer", "minimum": 1 },
    "max_merges_per_day": { "type": "integer", "minimum": 0 },
    "remote_model_budget_usd_per_day": { "type": "number", "minimum": 0 },
    "local_model_only_by_default": { "type": "boolean" },
    "require_branch_protection": { "type": "boolean" },
    "require_codeowner_review": { "type": "boolean" },
    "require_distinct_maker_checker": { "type": "boolean" },
    "require_distinct_maker_checker_model": { "type": "boolean" },
    "trusted_author_allowlist": { "type": "array", "items": { "type": "string" } },
    "protected_paths_extra": { "type": "array", "items": { "type": "string" } },
    "state_dir": { "type": "string", "minLength": 1 },
    "market_scan_enabled": { "type": "boolean" },
    "owner_approval_required_for_new_claims": { "type": "boolean" },
    "repo_network_enabled": { "type": "boolean" },
    "repo_network_dry_run": { "type": "boolean" },
    "share_raw_code_across_repos": { "type": "boolean" },
    "share_repo_identifiers_by_default": { "type": "boolean" },
    "snapshot": {
      "type": "object",
      "additionalProperties": false,
      "properties": {
        "ci_mode": { "type": "string", "enum": ["warn", "fail", "disabled"] },
        "sign": { "type": "boolean" },
        "parser": { "type": "string" },
        "token_budget": { "type": "integer", "minimum": 0 },
        "strict_redact": { "type": "boolean" }
      }
    },
    "roles": {
      "type": "object",
      "description": "Role registry. maker and checker are the first-class separation-of-duties pair (a distinct model each is enforced by require_distinct_maker_checker_model). Any other key is a crew role added in config with no core-code change; it carries the same optional runner/model/provider/transport/trigger/execution-target fields.",
      "additionalProperties": {
        "type": "object",
        "additionalProperties": false,
        "properties": {
          "runner": { "type": "string", "enum": ["local", "container"] },
          "model": { "type": "string", "minLength": 1 },
          "provider": { "type": "string", "minLength": 1 },
          "transport": { "type": "string", "minLength": 1 },
          "trigger": { "type": "string", "minLength": 1 },
          "execution_target": { "type": "string", "minLength": 1 }
        }
      }
    },
    "runners": {
      "type": "object",
      "additionalProperties": false,
      "properties": {
        "local": {
          "type": "object",
          "additionalProperties": false,
          "properties": {
            "labels": { "type": "array", "items": { "type": "string" } },
            "cli_path": { "type": "string", "minLength": 1 },
            "environment": { "type": "string", "minLength": 1 },
            "reachable_providers": { "type": "array", "items": { "type": "string" } },
            "reachable_endpoints": { "type": "array", "items": { "type": "string" } }
          }
        },
        "container": {
          "type": "object",
          "additionalProperties": false,
          "properties": {
            "labels": { "type": "array", "items": { "type": "string" } },
            "cli_path": { "type": "string", "minLength": 1 },
            "environment": { "type": "string", "minLength": 1 },
            "reachable_providers": { "type": "array", "items": { "type": "string" } },
            "reachable_endpoints": { "type": "array", "items": { "type": "string" } }
          }
        }
      }
    },
    "models": {
      "type": "object",
      "additionalProperties": {
        "type": "object",
        "additionalProperties": false,
        "properties": {
          "provider": { "type": "string", "minLength": 1 },
          "base_url": { "type": "string", "minLength": 1 },
          "exec_mode": { "type": "string", "enum": ["patch", "tool-loop"] }
        }
      }
    },
    "providers": {
      "type": "object",
      "description": "Optional provider registry override/extension. Merged over the built-in registry in scripts/agent/providers.mjs.",
      "additionalProperties": {
        "type": "object",
        "additionalProperties": false,
        "properties": {
          "transport": { "type": "string", "minLength": 1 },
          "costClass": { "type": "string", "enum": ["paid", "free", "local"] },
          "authEnv": { "type": "string", "minLength": 1 },
          "base_url": { "type": "string", "minLength": 1 },
          "defaultBaseUrl": { "type": "string", "minLength": 1 }
        }
      }
    }
  }
}
